{
  "formatVersion": 1,
  "id": "kubohiroyanamedfunctions",
  "blocks": [
    {
      "opcode": "awaitAll",
      "blockType": "REPORTER",
      "arguments": [
        {
          "id": "PROMISES",
          "type": "STRING"
        }
      ]
    },
    {
      "opcode": "awaitResult",
      "blockType": "REPORTER",
      "arguments": [
        {
          "id": "PROMISE",
          "type": "STRING"
        }
      ]
    },
    {
      "opcode": "callFunction",
      "blockType": "REPORTER",
      "arguments": [
        {
          "id": "ARGS",
          "type": "STRING"
        },
        {
          "id": "NAME",
          "type": "STRING"
        }
      ]
    },
    {
      "opcode": "defineFunction",
      "blockType": "HAT",
      "arguments": [
        {
          "id": "DESCRIPTION",
          "type": "STRING"
        },
        {
          "id": "EXPORT",
          "type": "STRING",
          "menu": "exportModes"
        },
        {
          "id": "NAME",
          "type": "STRING"
        },
        {
          "id": "RETURNS",
          "type": "STRING"
        },
        {
          "id": "SCHEMA",
          "type": "STRING"
        }
      ]
    },
    {
      "opcode": "defineSchema",
      "blockType": "HAT",
      "arguments": [
        {
          "id": "NAME",
          "type": "STRING"
        },
        {
          "id": "VERSION",
          "type": "STRING"
        }
      ]
    },
    {
      "opcode": "functionArgument",
      "blockType": "REPORTER",
      "arguments": [
        {
          "id": "PATH",
          "type": "STRING"
        }
      ]
    },
    {
      "opcode": "functionArgumentsJson",
      "blockType": "REPORTER",
      "arguments": []
    },
    {
      "opcode": "isDefined",
      "blockType": "BOOLEAN",
      "arguments": [
        {
          "id": "NAME",
          "type": "STRING"
        }
      ]
    },
    {
      "opcode": "isSchemaDefined",
      "blockType": "BOOLEAN",
      "arguments": [
        {
          "id": "NAME",
          "type": "STRING"
        }
      ]
    },
    {
      "opcode": "isSettled",
      "blockType": "BOOLEAN",
      "arguments": [
        {
          "id": "PROMISE",
          "type": "STRING"
        }
      ]
    },
    {
      "opcode": "lastError",
      "blockType": "REPORTER",
      "arguments": []
    },
    {
      "opcode": "returnValue",
      "blockType": "COMMAND",
      "arguments": [
        {
          "id": "VALUE",
          "type": "STRING"
        }
      ]
    },
    {
      "opcode": "schemaAdditionalProperties",
      "blockType": "COMMAND",
      "arguments": [
        {
          "id": "ALLOW",
          "type": "STRING",
          "menu": "allowModes"
        }
      ]
    },
    {
      "opcode": "schemaAllowedValues",
      "blockType": "COMMAND",
      "arguments": [
        {
          "id": "VALUES",
          "type": "STRING"
        }
      ]
    },
    {
      "opcode": "schemaConstraint",
      "blockType": "COMMAND",
      "arguments": [
        {
          "id": "KEYWORD",
          "type": "STRING",
          "menu": "constraintKeywords"
        },
        {
          "id": "VALUE",
          "type": "NUMBER"
        }
      ]
    },
    {
      "opcode": "schemaJson",
      "blockType": "REPORTER",
      "arguments": [
        {
          "id": "NAME",
          "type": "STRING"
        }
      ]
    },
    {
      "opcode": "schemaProperty",
      "blockType": "COMMAND",
      "arguments": [
        {
          "id": "NAME",
          "type": "STRING"
        },
        {
          "id": "PRESENCE",
          "type": "STRING",
          "menu": "presenceModes"
        },
        {
          "id": "TYPE",
          "type": "STRING",
          "menu": "propertyTypes"
        }
      ]
    },
    {
      "opcode": "schemaPropertyArraySchema",
      "blockType": "COMMAND",
      "arguments": [
        {
          "id": "NAME",
          "type": "STRING"
        },
        {
          "id": "PRESENCE",
          "type": "STRING",
          "menu": "presenceModes"
        },
        {
          "id": "SCHEMA",
          "type": "STRING"
        }
      ]
    },
    {
      "opcode": "schemaPropertySchema",
      "blockType": "COMMAND",
      "arguments": [
        {
          "id": "NAME",
          "type": "STRING"
        },
        {
          "id": "PRESENCE",
          "type": "STRING",
          "menu": "presenceModes"
        },
        {
          "id": "SCHEMA",
          "type": "STRING"
        }
      ]
    },
    {
      "opcode": "startFunction",
      "blockType": "REPORTER",
      "arguments": [
        {
          "id": "ARGS",
          "type": "STRING"
        },
        {
          "id": "NAME",
          "type": "STRING"
        }
      ]
    }
  ],
  "menus": [
    {
      "id": "allowModes",
      "acceptReporters": false
    },
    {
      "id": "constraintKeywords",
      "acceptReporters": false
    },
    {
      "id": "exportModes",
      "acceptReporters": false
    },
    {
      "id": "presenceModes",
      "acceptReporters": false
    },
    {
      "id": "propertyTypes",
      "acceptReporters": false
    }
  ]
}
